{
  "$schema": "https://json-schema.org/draft/2020-12/schema",
  "title": "Benchmark Claim Charter",
  "type": "object",
  "additionalProperties": false,
  "required": [
    "charter_id",
    "version",
    "generated_at",
    "purpose",
    "evidence_classes",
    "ranking_rules",
    "claim_boundaries",
    "source_paths",
    "safety_assertions"
  ],
  "properties": {
    "charter_id": {
      "type": "string",
      "const": "m54_local_benchmark_claim_charter"
    },
    "version": {
      "type": "string",
      "minLength": 1
    },
    "generated_at": {
      "type": "string",
      "pattern": "^\\d{4}-\\d{2}-\\d{2}T\\d{2}:\\d{2}:\\d{2}Z$"
    },
    "purpose": {
      "type": "string",
      "minLength": 1
    },
    "evidence_classes": {
      "type": "array",
      "minItems": 1,
      "items": {
        "type": "object",
        "additionalProperties": false,
        "required": [
          "evidence_class_id",
          "label",
          "claim_scope",
          "public_ranking_eligible",
          "committed_fixture_allowed",
          "private_data_allowed",
          "credentials_required_allowed",
          "live_execution_allowed",
          "required_metadata",
          "allowed_claims",
          "prohibited_claims"
        ],
        "properties": {
          "evidence_class_id": {
            "type": "string",
            "minLength": 1
          },
          "label": {
            "type": "string",
            "minLength": 1
          },
          "claim_scope": {
            "type": "string",
            "minLength": 1
          },
          "public_ranking_eligible": {
            "type": "boolean"
          },
          "committed_fixture_allowed": {
            "type": "boolean"
          },
          "private_data_allowed": {
            "type": "boolean"
          },
          "credentials_required_allowed": {
            "type": "boolean"
          },
          "live_execution_allowed": {
            "type": "boolean"
          },
          "required_metadata": {
            "type": "array",
            "minItems": 1,
            "items": {
              "type": "string",
              "minLength": 1
            }
          },
          "allowed_claims": {
            "type": "array",
            "minItems": 1,
            "items": {
              "type": "string",
              "minLength": 1
            }
          },
          "prohibited_claims": {
            "type": "array",
            "minItems": 1,
            "items": {
              "type": "string",
              "minLength": 1
            }
          }
        }
      }
    },
    "ranking_rules": {
      "type": "object",
      "additionalProperties": false,
      "required": [
        "public_rankings_require_public_evidence",
        "private_only_evidence_excluded_from_public_rankings",
        "local_rankings_must_be_labeled_local",
        "cloud_rankings_require_cloud_evidence",
        "manual_samples_excluded_from_rankings_by_default"
      ],
      "properties": {
        "public_rankings_require_public_evidence": {
          "type": "boolean",
          "const": true
        },
        "private_only_evidence_excluded_from_public_rankings": {
          "type": "boolean",
          "const": true
        },
        "local_rankings_must_be_labeled_local": {
          "type": "boolean",
          "const": true
        },
        "cloud_rankings_require_cloud_evidence": {
          "type": "boolean",
          "const": true
        },
        "manual_samples_excluded_from_rankings_by_default": {
          "type": "boolean",
          "const": true
        }
      }
    },
    "claim_boundaries": {
      "type": "array",
      "minItems": 1,
      "items": {
        "type": "string",
        "minLength": 1
      }
    },
    "source_paths": {
      "type": "array",
      "minItems": 1,
      "items": {
        "type": "string",
        "minLength": 1
      }
    },
    "safety_assertions": {
      "type": "object",
      "additionalProperties": false,
      "required": [
        "public_safe",
        "live_execution",
        "external_actions",
        "contains_private_data",
        "credentials_required"
      ],
      "properties": {
        "public_safe": {
          "type": "boolean",
          "const": true
        },
        "live_execution": {
          "type": "boolean",
          "const": false
        },
        "external_actions": {
          "type": "boolean",
          "const": false
        },
        "contains_private_data": {
          "type": "boolean",
          "const": false
        },
        "credentials_required": {
          "type": "boolean",
          "const": false
        }
      }
    }
  }
}
